title,content,topics
"Unwanted Solutions","Advice for a better tomorrow often focuses on the past. Yet, in the grand scheme of cosmic time, our lives are incredibly brief. Embrace life as it is without seeking constant solutions.
 
 Don't worry about being labeled good or bad; acknowledge yourself and your desires. Remember that sometimes people seek solutions when there aren't any problems to solve. 
 The influx of unsolicited advise via WhatsApp further exacerbates it, almost compelling one to find a problem.","musings, random"
"India's Secular Stabilizer","India's secular nature is not due to its minority, but rather its majority. The Hindu majority prevents the country from becoming a single-religion theocracy. Despite concerns about changes in India, it remains steadfast in its values because of this religious majority.
 
 In other countries with one dominant religion, many have become theocratic. Although India faces many problems, they don't stem from the majority wanting systemic change. Instead, these issues arise from fractured mandates in democratic elections.
 
 Without such divisions, no party could gain enough power to alter India's constitution significantly. Few people may try to change our country's ethos. But while the constitution may evolve over time, India will remain true to itself and maintain its core values of ""Sab ke saath, Sab ka vikas"".",musings
"Trust Your Judgment","Relying too much on others' advice can weaken your own judgment. When facing challenges, you might struggle to apply these principles. 
 Instead, seek answers within yourself; you often know what's best for you.
 
 Focus on discovering your true desires in life, whether it's related to studies, career, or relationships. Be genuinely nice instead of pretending; even if people don't respond positively, you'll feel good within.",musings
"Loneliness in a Material World","Loneliness is a growing issue reaching almost epidemic levels. What causes this feeling? It's not simply being alone, as one can feel lonely even in a crowd. Loneliness stems from our thought processes and the beliefs we hold about ourselves.
 
 When people focus on exclusivity, believing they are important or superior due to wealth or status‚ they may isolate themselves. This self-imposed isolation can lead to loneliness if there's no one around to challenge their views or share experiences with them.
 
 It's crucial for individuals to recognize that they're part of the larger human tribe and should connect with others rather than seeking separation. There's nothing wrong with aspiring for wealth; however, it shouldn't create an exclusive mindset where accumulating possessions takes priority over forming relationships.
 
 Society often places celebrities on pedestals, leading to envy and jealousy among those who desire similar lifestyles. But it's essential to remember that material possessions have price tags but not intrinsic value. Feeling connected and fulfilled comes from understanding what truly matters in life – relationships, personal growth, and embracing our shared humanity.",musings
"My Parent's Anniversary","Today is a special day in my life, as it's not only Mother's Day but also the wedding anniversary of my parents. I recently came across their marriage details written by our father in our family Bible, and it has made me quite nostalgic.
 
 Though I knew they married young, the records confirmed that our dad was 24 and our mother just 21 when they tied the knot in Bombay. I'm unsure about how many people from Diwar attended their wedding, but I know that my auntie and my mother's family were present.
 
 The expectations during that era were different; companionship seemed to be more important than high ambitions. This makes me reflect on how sometimes small things matter much more than what we can hold on to in life.","family, memories, musings"
"Happiness Within","Yesterday, I took my usual walk with my dog and crossed paths with a man probably in his late 70s. He had a calm demeanor, wearing a neatly pressed shirt that seemed to reflect the peace he felt within himself. His serene expression made me wonder what he was thinking and reminded me of a saying – Getting off at the next stop .
 
 In today's world, many people appear to be unhappy or dissatisfied after their prime age. Instead of finding inner peace, they blame their problems on external factors like authorities or other individuals. Social gatherings often turn into discussions where people complain about their surroundings rather than focusing on finding happiness within themselves.
 
 I've come to realize that frustration stems from our own dissatisfaction rather than outside sources. If someone isn't happy with themselves, they' often look for reasons to blame others as an escape from facing their own issues.
 
 It's important for us to take time and reflect deeply on how we can improve our lives by making our worlds smaller and more focused on ourselves and our families. We shouldn't try solving global problems when there are unresolved issues in our personal lives.",musings
"Dirty Paws","During a casual conversation with a friend, we both discovered our shared love for dogs. My friend mentioned that they changed their floor tiles to brown because they didn't want to see the dirt their dog brought in. However, I have white tiles and my dog comes in often as well. Instead of hiding the dirt, I prefer cleaning it up.
 
 Over time, it became difficult to clean the dirt every time my dog came inside. So I adjusted my mindset and started viewing my dog's paw prints as works of art, which put me at ease until it's cleaned. This change made me question if I was genuinely embracing this new perspective or just doing so out of convenience.
 
 Ultimately, who is right? Should one install brown tiles to mask the dirt or keep white ones that display paw prints more visibly? The answer remains uncertain.",musings
"Siblings","We often focus on major breakthrough and overlook the smaller things in life, such as the kind gestures we receive from others. In my case, I am fortunate to have had nine siblings, six of whom live within close proximity. This allows us to exchange thoughtful gestures like sharing homemade delicacies.
 
 In a time when families are becoming more nuclear and there's less warmth in our surroundings, having siblings nearby is a true luxury. I wish for future generations to experience at least 50% of this closeness and connection that I enjoy with my family.","family, musings"
"Revitalizing Democracy","Democracy Needs Change
 
 Election time used to be exciting with canvassing starting a month in advance, loudspeakers announcing the upcoming date, and passionate slogans filling the air. Meetings at the main square were customary, engaging not only eligible voters but also younger generations who could gauge voter preferences based on meeting attendance. People eagerly voted for governance instead of rulers.
 
 However, this enthusiasm is now missing as people choose rulers and surrender their power. Democracy needs reforms to revitalize its process:
 
 1. Limit elected officials to two tenures (continuous or otherwise).
 2. Lower the voting age to sixteen.
 3. Implement primary and secondary voting where top two candidates in the primaries compete in the secondary round for majority approval, avoiding situations where someone wins with less than a majority.
 4.Once elected, ban defection to other parties, instead, only allow resignation accompanied by a forced five year break from political activities.
 
 Some may argue against these changes due to expenses involved; however, investing in democracy is just as crucial as investing in our defense budget for securing our nation's future.",musings
"Gathering in Numbers","At a farewell party for Neha last night, I was struck by the joy of numbers. Not simply from counting the parties or the guests , but from the emotional connections they represent which is minus guests. Born into a large family where gatherings are in tens rather than units, what others see as a crowd is our normality. This abundance often taken for granted now holds more value as the young are spreading in different directions to pursue education or careers.
 
 This shift has made me appreciate these moments and anticipate nuclear families becoming their norm too. Having experienced such abundant gatherings will hopefully remind them in reinforcing our shared joy of numbers.","family, memories, musings"
"Reflections at a Funeral","At a colleague's funeral, I found myself standing before the niche of Maria Carlotta de Rego Aguiar. I'd seen this face many a times but today it dawned on me that she is my great-grandmother on my mother's side. It brought home the fact that I owe my existence to this woman – a sobering realization indeed.
 
 Looking around at lifelong friends attending mass with me, it was clear how time had etched its mark on us all. Our shapes altered, walks slowed and looks changed; life is certainly different from our youthful days.
 
 Gazing at the church, I pondered if my great-grandmother had walked this very path when things were starkly different. Being in our shared birthplace felt like an indulgence; connecting myself to several generations rooted here made me feel deeply native.
 
 Today reinforced that embracing one's roots creates a strong sense of belonging, something we often neglect but should cherish instead.","family, memories, musings"
"Driving to Panjim","I've observed how my feelings fluctuate based on varying circumstances. For instance, I endured a dreadful drive in Panjim yesterday. It took one hour for me to cover just five kilometers. As usual complaining about the incompetence of the officials was stressful. While they seemed to revel in it, I was the one punishing myself.
 
 On the contrary, today's early morning's journey back to Panjim, to take part for an EV Rally was delightful. Despite traveling on same road as yesterday (minus the jam), listening to soothing music enhanced my travel experience and sparked some introspection. Had I listened to music yesterday the outcome would have been different.
 
 We often merely anticipate life's best offerings rather than actively seeking them.
 
 This contrast between yesterday and today illustrates that difference: expecting versus pursuing life's rewards. Yesterday was about expectation; today emphasized pursuit. The key is not simply to expect but also strive for life's best, it puts you in control.",musings
"Expanding Neighborhoods","The definition of a neighborhood has changed, for the worse. Previously, neighbors existed within a square kilometer and we navigated all events, good or bad, within this boundary. This system fostered mutual understanding without disrupting personal peace.
 
 However, the advent of WhatsApp has blurred these borders. Unwanted information invades our homes uninvited, becoming an unwelcome norm. Recent examples include local disputes or priestly opinions that would previously remain unknown to us; now they consume unnecessary time in late-night discussions.
 
 It's essential to be selective about what you allow into your consciousness, unless you wish to spoil life's pleasant moments.","musings, random"
"Mastering Happiness","Happiness relies on mental cultivation. Our minds, akin to monkeys, leap in various directions; remember that you alone are its master. Train it to embrace thoughts that maintain your cheerfulness.
 
 While ""practice makes perfect"" is a familiar saying, we often apply it solely to physical activities. Pause and practice invoking the right trigger for positive emotions. Though short lived at first, repetition will enhance your happiness proficiency.
 
 
 In Konkani, it is said:
 Zhem tum monan ghalta, tosoch tuzo sounsar choltha. 
 Monan umed ghalath.",musings
"On Death","Death Speaks:
 
 Why am I maligned in life, yet glorified once I strike? Humanity ought to recognize that life's splendor exists due to me. Without my presence, life itself would cease. People must comprehend that I am the cause for celebrating life - all this without expense or petition.
 
 All they need do is relish their time. Do not inquire how long; it is not intended to be known. 
 Fear me not, though many succumb to this misperception.
 
 Rather than fretting about your destination after death, wonder where you came from. To that place, I shall return you.",musings
"Acceptance is Serenity","Living life without anxiety is best achieved through acceptance, particularly in trying times. It is only human for us to feel devastated upon hearing unexpected news, these are the moments our brains secrete less of the biochemical which excites us . Owing to our upbringing, we often entertain the same thought a thousand times, potentially leading to depression.
 
 At such instances, applying logic is crucial. While easier said than done, this is mainly because we rarely give it a chance. Take a moment to envision your near future – you know you will eventually overcome these feelings. So, what stops us from feeling that way now, just as we would in time? It is our choice to live in ignorance of facts; facts we know but refuse to entertain.",musings
"Indebted","We often take much for granted, immersing ourselves in ego, mistakenly believing we are the pinnacle of existence. In this chain of life, we focus primarily on the present and future, neglecting to duly acknowledge the past.
 
 By ""past,"" I refer not to my own history, but to the generations that came before me. This realization struck me while teaching my granddaughter our mother tongue, Konkani. 
 I pondered the ancestors who labored to assign meaning to the sounds we now call language and the numerous generations it must have taken for their efforts to be well-received and understood.
 
 I feel compelled to appreciate these endeavors and recognize that I am not solely a product of my own making, as I once believed. Therefore, I amend my belief: I owe a great deal to past generations and am indeed indebted to them.","family, musings"
"November","November, a name that may vary in other languages, evokes a sense of festivity for me. Perhaps it is due to our chapel feast of the Lord Redeemer. I recall eagerly counting down the days a month in advance.
 
 My route to school would shift to Golthechan, as I anticipated the first signs of festivity: the commencement of earth digging to install wooden poles for the shamiana. I remember the excitement of sharing this news with others. The following ten days would fly by, altering my routine. Indeed, it was the only time I'd leave a football game early without remorse, and so would my peers.
 
 The hot water bath from the Bhand, the aroma of straw that accompanied gushing water, my attire, and my spirited walk towards the chapel were all highlights. The petromax's filtered light illuminated the trees at varying degrees as I approached my destination. The choir's harmonious sound and the tempting smell of bhajjas mingled with naphthalene balls, indicating the presence of clothes that had been stored for almost a year. Despite struggling to fit into one-year-old shoes, the thrill of being there made it worthwhile.
 
 However, this November feels different. The pandemic has taken its toll; people have surrendered to self-invited gloom. The village appears in mourning, lamenting its first fatality‚ once just a statistic but now a personal tragedy.
 
 As someone who believes life is meant to be lived fully, not merely survived, I am eager to bring back festivity. With necessary precautions in place, on November 15th, I will attend the Redemptor Saibachem Fest at Armacar Niwas.","memories, musings"
"The Paradox of Nothingness","Life begins with nothing and appears to end with everything, which ultimately means nothing. In life, everything is nothing, and nothing is everything. Our journey is false if based solely on objectivity. The only true presence in your life is absolute consciousness, not dependency. This blissful state of mind is the ultimate goal, or in worldly terms, heaven. Here, it is acknowledged that even nothing holds value through detachment.
 
 The value of 10 is hidden within the numbers 0 to 10, yet we begin counting at 1. This oversight in our education suggests that everything starts from something, which is incorrect; it starts from nothing which is something. Be reminded that zero's value depends on which side its placed.
 
 Theistic religions emphasize objectivity, enticing followers with the prospect of holding onto or being rewarded with these objects after life's end. This notion is misguided.
 
 At a human level, we engage in this deception but should recognize that detachment is the key.",musings
"Highs and Lows","Cherish Life
 A sudden urge to appreciate life, often overlooked, arises within me.
 It's clear that life is a pendulum,
 Swinging between highs and lows.
 Nothing endures eternally, neither peaks nor valleys,
 Yet the valleys weigh heavier than the elation of peaks.
 
 To truly cherish life, we must embrace the highs doubly so, counterbalancing the lows ahead.
 Today is such a day for me,
 And I'm wholeheartedly reveling in its amplified joys.
 3/3/23",musings
"Unity Amidst Crisis","22nd March 2020
 This day was truly exceptional.
 The dawn was unusually quiet, devoid of mechanical noise.
 Nature took control.
 The sky was clearer, and the crescent moon seemed to smile, as if saying, ""Now you know.""
 The poor felt rich as wealth lost its meaning.
 
 Indeed, humans quarantined themselves to combat the coronavirus.
 
 Neighbors united while staying apart,
 The Gods cooperated, absolving the faithful from rituals.
 
 This effort, dubbed Janata Curfew,
 Was not enforced but voluntarily observed for humanity's sake.
 
 It was a national call,
 India uniting without religion, caste, or political ideology.
 
 This intrigues me.
 Why are we divided during prosperity,
 Yet united in crisis?
 As humans, we desire a happy life,
 And that is what truly matters.
 We should not need a virus to awaken us.
 Perhaps this lesson, learned the hard way,
 Promises better days ahead.",musings
"Embracing Seniority","Lately, I've received comforting words about being a senior citizen. While it has its merits, I refuse to deny my aging reality.
 
 As a senior, I embrace unbounded freedom, akin to a vagabond. Busyness no longer defines my worth, and I've freed myself from most responsibilities without guilt. At times, I relish the solitude of silence.
 
 I've savored the sweet and sour experiences of youth. Reflecting on a song lyric that resonates with me: If there was a well of youth, I wouldn't take a sip, and that's the truth.
 
 Feeling content with fulfilling my duties well, I recall moments once aspired for in the future. Realizing that the desired future is now, I don't plan to halt my journey but will pause to appreciate my accomplishments. 
 
 With humility and no regrets, I stand ready to pack my bags for the next to come.","musings, memories"
"Rediscovering Youthful Joy","Ah, the Joys of Youth
 
 Few would contest the notion that youth is a delightful period in one's life. This is primarily due to the unburdened and autonomous nature of a young mind. However, as we age, our minds become trained in seriousness, replacing innocence with contemplation.
 
 In this state, vulnerability emerges, making one susceptible to radical influences. Individuals may feel compelled to join a particular group or adopt specific beliefs. Concepts such as God are propagated by the educated, leading to the identification of others by race or religion. Consequently, segregation takes root and an unspoken assertion arises: ""My God is superior to yours."" (here I must mention that education without secular mindset is ignorance.)
 
 This mindset fosters hypocrisy, ultimately resulting in the belief that life is a struggle.
 
 To rediscover the joy and playfulness of youth, cleanse your mind and resist indoctrination. Begin anew, without opinions or judgments from the past. Give it a try – you may not be able to articulate the difference, but you will certainly experience it. 
 Stay young.",musings
"Make your world smaller","Social media can be blamed for much of the restlessness in today's society. The term ""like-minded"" has become increasingly relevant, though one may wish it had remained a simple concept. Many individuals connect on social media platforms, claiming to be like-minded.
 
 If you find yourself on such a platform, it is wise to carefully filter content that does not align with your preferences. Alternatively, consider scantily using Facebook and Twitter, where opinions are often met with contention.
 
 For the sake of peace, make your world a little smaller. We were never designed to know every global event. If you find yourself addicted to social media, try satisfying the craving with a cigarette instead.",musings
"Between Zero and One","Society craves immediacy,
 Demanding swift conclusions.
 Fixated on binaries,
 Good or bad, happy or sad,
 Healthy or sick, pass or fail,
 Truth or lie.
 Yes or No.
 Such judgments lack distinction.
 
 We count one, two, three,
 Yet serenity lies between.
 Value resides between zero and one.
 
 Not telling the truth isn't lying 
 Ponder.",musings
"Discovering Bliss","1) Self-imposed isolation leads to unintended consequences
 2) Absence of gratitude
 3) Masquerading self-pity as victimhood
 4) Incentivized appreciation
 5) Relying too heavily on blessings, ignoring self role
 6) Denying the possibility of being the problem
 
 Cultivate habits to prevent these behaviors and discover bliss.",musings
"Early Memories","With time on my hands, I decided to revisit my earliest memory. What an experience it was – almost like a fantasy at play, with flashbacks aplenty. It's challenging to pinpoint if it was indeed the earliest memory.
 
 Give it a try, and you'll realize the delightful company you are to yourself.","memories, musings"
"Opinions, Knowledge, and Clarity","Opinion: A view or judgment on something, not necessarily based on fact or knowledge. The intriguing part is that it's not always grounded in facts or knowledge. Pause for a moment and consider how opinionated you are, and how much it governs your thought process. How much of it is truly based on facts or knowledge? For myself, I find the answer to be less than fifty percent. So why should such notions dominate most of my life?
 
 I've resolved to refrain from being overly opinionated and to seek facts and knowledge before accepting a statement as true. This endeavor has cleared much clutter from my mental storage, invigorating my pursuit of knowledge. It has bolstered my confidence in admitting, ""I don't know."" Furthermore, it has reinforced my belief that knowing you don't know is the essence of knowledge.
 
 Many a time, opinion had deceived me into thinking it was knowledge.",musings
"School","I awoke as usual, yet something felt different. I noticed the birds chirping and could discern at least nine distinct melodies. This experience transported me back to my school days.
 
 The morning rituals: grabbing my bag, walking the muddy road, feeling the mist in the air and the dampness on the weeds. The sound of the bell, and the hurried final steps to arrive on time for assembly. The punctuality of the first few days, with tidy books and completed homework, gave me a sense of pride that I had grown since the previous year – even if it only lasted a few weeks.
 
 Singing ""Happy Birthday"" for a classmate, anticipating an extra share of sweets as their best friend. Attempting to impress girls in hopes of future courtship. All these memories seem so wonderful, yet I still longed for holidays back then. Now I wonder why – yes, I truly miss my school days.","memories, musings"
"Life's Progress","Life: a work in progress,
 Indeed, progress.
 Enhance your life and those around,
 Release unwanted baggage.
 
 Sacrifice your ego's claim, ""I am right,""
 Such attitudes aren't progress, but regression.
 Clinging to unwanted baggage too long turns it to garbage,
 And then, you simply stink.",musings
"Names","What's your name? This question seems to appear less frequently as we age. Do you remember when young the pride in answering this query, chest puffed out, declaring your name?
 
 As we grow older, it may feel rude to ask someone their name directly. Instead, we opt for the more polite, ""May I know your good name?"" But why the change?
 
 It's quite simple: one expects to be recognized. ""Don't you know me?"" If not, it's your responsibility to humbly inquire.
 
 This isn't merely about names or identity; it's about who we are beyond our monikers. Consider this: who would you be without a name? It's a perplexing thought.
 
 You might realize that you'd still be yourself but without identification. Thus, the importance of our names becomes clear.
 
 However, as time passes, our names alone may feel insufficient. We begin to focus on prefix and suffix such as qualifications, achievements, wealth, and so forth. We expect recognition through these additions rather than just our names.
 
 This mindset warrants reconsideration. Remember that the most beautiful sound one is attracted to is their name. Forget the prefixes /suffixes and strive to be worthy of being directly asked or called by your name.",musings
