title,content,topics
Seeking Answers in Adolescence,"The seventies marked an awakening in my life. As an adolescent, my curiosity peaked, and I sought the purpose of my existence. This period intensified due to circumstances beyond my control, driving me to find stability within and around me.
 
 This decade continued the hippie culture of the sixties. The saffron robes of Bhagwan Rajneesh's followers, later known as OSHO, were visible everywhere. My curiosity led me to explore Rajneesh's teachings while balancing practicality and fantasy. I knew that ultimately, I needed to focus on work and provide food for the table. However, this didn't deter me from learning about Rajneesh and his predominantly foreign following. I pondered why these seemingly wealthy individuals sought answers in India.
 
 I purchased some of his books from flea markets in Anjuna and later acquired cassettes when Walkmans became popular. Some of his quotes profoundly influenced my life and pursuit of self-understanding:
 - Darkness is merely the absence of light; light a candle, and you will see the light coming in but not the darkness going out.
 - To know you don't know is knowledge; not to know you don't know is ignorance. Knowledge isn't knowing everything but knowing that you don't know.
 - Don't worry about life after death; ensure you're living before death.
 - Don't be a follower; be a student. Followers obey instructions, while students discover the truth.
 
 These quotes, though perhaps not exact, provided me with a sense of comfort within myself and my surroundings.","memories, musings"
Bombay,"My first trip outside Goa was to Bombay, now Mumbai, in the late 70s. My uncle Cruz, visiting from Kuwait, invited me to join him and his family. Eagerly, I accepted. We traveled by bus, which back then lacked air conditioning and had rattling windows that made sleep elusive. The journey took around 14 hours due to the steep ghats.
 
 We arrived in Bombay early the next morning. The city's stench was overwhelming, a stark contrast to my village life. During my stay, I marveled at the Gothic architecture and enjoyed the less crowded atmosphere compared to today's bustling metropolis. However, I did not use the railways—a wise decision considering my inability to cope with such chaos.
 
 After a week, I boarded a steamer for my return journey. Unprepared, I brought only cigarettes and no bedding or blankets for the night. The daytime voyage was pleasant; passengers mingled and enjoyed camaraderie during our 24-hour journey. At night, I won one hundred rupees playing housie and treated myself to a beer.
 
 The cold night forced me to stay close to the engine room where I consumed most of my cigarette pack. As we approached Goa's coast from the Arabian Sea, the sight of pine trees evoked a sense of belonging. That memorable trip remains close to my heart.","family, memories, musings"
Presence,"Reading these reflections, one might think I'm stuck in the past, nostalgic for the 70s and 80s. But I live in the present, grateful for how my past shaped today. I focus on the now rather than dwelling on the future.
 
 So why do my most vivid memories come from thirty years ago? The last 35 years have brought many blessings: marriage, children, prosperity, and respect. Life has gotten better. Perhaps I was less conscious of my goals then; I moved through life more instinctively.
 
 My cherished memories come from times when I was truly present. Today, life moves so fast that we often miss the journey, fixating only on the destination. Once there, we immediately look to the next goal, never fully experiencing the moment. This might explain why those earlier years remain so clear in my memory.","memories, musings, family"
Barberias to Salons,"The term 'barberia' has evolved into 'salon,' and with it, the entire trade has transformed. Initially, barberias were masculine spaces, frequented solely by men for haircuts or shaves. They were monopolized by specific castes and passed down through generations, resulting in highly skilled craftsmen called 'malle' in Konkani.
 
 The atmosphere at a barber's shop was unique. Visiting the barber was not only for grooming services but also to catch up on village news. Barbers had a knack for securing their customers' agreement, perhaps due to the sharp razor or scissor sounds. Disagreements were rare; there was either silence or support for the barber's views.
 
 Today's salons differ greatly; they are unisex and offer a wider range of services with various hairstylists. Upon arrival, clients choose from different massages and treatments, while hairstylists often become salespeople promoting beauty products. One is careful not to disappoint them as one's future appearance lies in their hands.
 
 In contrast, at the barberia, one could simply request a haircut or shave without much fuss. Options were limited to military cuts or normal ones. Occasionally, one would be at the mercy of an apprentice. In such cases, you might hear the common term 'hampailo,' which referred to a botched haircut.
 
 These memories remain vivid as I recall being a victim of an apprentice myself.","memories, musings"
Diwar Summer Camps,"The excitement of May, with its promise of holidays for our children, always transports me back to my own younger days. Summer camp, as the eager youngsters called it, was a family gathering that brought together a diverse group of children, some as young as a few months old. Being ten siblings, not all married at the time, the camps had two phases, and in the first phase, our nieces and nephews eagerly anticipated these reunions.
 
 Somehow, I managed to fit everyone into my Gypsy, along with two bicycles and luggage. Once we arrived at the holiday home, the atmosphere was one of freedom and spontaneity. No particular schedule dictated meal or bath times, and activities like fishing expeditions or cricket games were filled with laughter and friendly arguments.
 
 A shared bathing experience at the well became a lottery system to determine the order. As the final days approached, pleas to the gods for an extended stay were common. I took on the role of divine mediator and granted their wishes, sending the youngest off to pray at nearby crosses. These moments allowed me to relive my youth while witnessing their joy.
 
 On their departure, some took a stone or leaf as a souvenir to preserve cherished memories. Now, all from the first phase have grown and some are scattered across the globe. I hope they still treasure those moments spent together.","family, memories, musings"
Equity vs Equality in Business,"Equitable and equal may sound similar, but there is a significant difference between the two, particularly in the realm of business. We often proclaim that everyone is equal when it comes to agreements or official documents. However, one must accept that equality does not always yield the desired outcome. It is equity that makes things work.
 
 In certain situations, strictly adhering to a document can hinder progress. For instance, it's akin to asking a chef not to taste their food for fear they might consume it. In the world of business, everything is negotiable unless it negatively impacts the system or diminishes value. Thus, it is crucial to embrace equity rather than solely focusing on equality.
 
 The famous legal maxim states: 'The law is equal for all men, but all men are not equal before the law.'",musings
Reflections on my Academic Journey,"From time to time, I find myself reminiscing about particular incidents, and I felt the urge to record one such memory. My academic journey from high school to earning two degrees was rather challenging, so much so that I nearly dropped out in the tenth grade. This wasn't due to a lack of intelligence, but rather a lack of enthusiasm and focus. Nonetheless, I carried on.
 
 One day, I resolved to reevaluate my life. I purchased a cigarette pack at the GMC canteen and sat in the nearby park, then known as the children's park. As the fresh air quickened my cigarette's burn, I pondered my future without pressure. This introspection brought to mind my father's hopes for me - to become a lawyer. It was a sudden realisation that put me back on course.
 
 Though unable to attend daily classes, I compensated by studying intensely in the college library a month before exams. This pattern persisted until I completed law school. The flashback inspiring this writing took place during my first year of law exams.
 
 Frequent library visits at law college familiarized me with college staff, whose casual demeanor influenced me during exams and made me overly relaxed. After completing all my papers, I awaited the results. To my dismay, the results indicated me , Absent and while the one ahead of me passed. I knew the surrounding benches were empty; therefore, it must have been me who occupied his seat.
 Proving this was difficult since all records showed he had answered.
 
 The only solution was obtaining a declaration from the actual absentee student and having it endorsed by the college. Thus, I tracked him down to his bank job in Bicholim. Upon asking about him, everyone shouted his name: ""Parsekar hanga yo!"" ; They were all aware of this mix-up.
 
 He kindly signed the declaration without hesitation and advised me to be cautious since things could have been worse.
 
 Since then, I've attempted not to be too casual in my endeavors – though admittedly, I am still only halfway there.","memories, musings, family"
"Ego: Vice, Virtue, or Balance?","Ego, in my opinion, is not the negative trait society often labels it as. It seems hypocritical to categorize it as a vice since everyone possesses this inherent characteristic. One might question why it is not considered a virtue instead. I believe this perception stems from the overrated value placed on humility. I must admit that excessive humility can border on arrogance.
 
 Ego rightfully has a place within our character, but moderation is crucial. An excess of ego may hinder our acceptance within society, as no individual can thrive in isolation. While ego can bolster confidence, it should not obstruct the merit of any discussion. The key lies in accepting what is right, not who is right.
 
 Contrary to popular belief, a person with ego is not devoid of ambition. When managed properly, ego serves as a catalyst for ambition. Therefore, I contend that ego is not the negative force it is often perceived to be.",musings
Nature's Indifference to Philanthropy,"Philanthropy, a distinctly human concept, seeks to benefit society. We frequently hear about climate change and experts often provide suggestions through conferences and PowerPoint presentations. While we observe alterations in nature's patterns, many attribute these changes to human behavior and call for adjustments. However, I believe this shift occurs due to nature's inherent laws.
 
 Consider the fact that planet Earth was once in an ice age; what brought about the current state are its natural laws. This suggests that nature is indifferent to our actions, tending to itself. Our responsibility lies in managing our lives effectively. Nature's primary concerns involve the growth, procreation, demise, and decay of its inhabitants. Nothing more, nothing less.",musings
Time Pass,"Upon retirement; individuals often grapple with detaching from the routine imposed by their profession, which nearly stripped them of their identity. Consequently, the phrase ""time pass"" frequently arises. But what does it genuinely imply?
 
 It is essential to acknowledge our inability to control time, as it waits for no one. 
 
 In moments of idleness, refrain from lamenting boredom and instead embrace the freedom to pursue your desires, which were once hindered by work obligations. Now, seize the chance to learn the art of enjoying your own company, you won't feel lonely though you may be alone your cherished memories will come to your rescue.
 
 This provides mental nourishment and aids in remaining present in each moment. Be vigilant not to squander even a minute without full engagement, for wasting sixty seconds means forfeiting valuable opportunities.
 
 In future instances of time pass, remind yourself that every day is a new day and not a continuation of yesterday.","musings, memories"
Religion's Hypothesis,"The primary source of belief in the supernatural stems from an insecurity we have nurtured: religion, a human-made concept. What is this insecurity? The answer lies in death.
 
 Naturally, all living beings possess inherent traits for survival, striving to any extent to achieve it. In other words, it is an animal world of survival. However, as humans, we differentiate ourselves from other beings due to our rational approach. To coexist harmoniously, we developed religion.
 
 Today, religion serves as a means to evade death and even suggests that life is immortal if one adheres to its teachings. This assurance of life after death can be better or worse, depending on how one lives their first life. Consequently, followers are often left confused, desiring heaven but unwilling to die on earth.
 
 Hence, my advice is not to worry about life after death; live while you are alive instead of merely surviving. The debate surrounding God's existence remains open; one is free to choose their deity based on personal comfort. As long as your beliefs help you accept life's finiteness and encourage making the best of your time on earth.
 
 Also, it's worth pondering – if life was eternal, would the notion of a deity exist?",musings
"Prayer, Insecurity, and Self-Confidence","I often notice individuals praying fervently, seemingly due to insecurities. 
 It is essential to distinguish between what is within our control and what is not. Excessive prayer may, in fact, undermine our self-confidence. As the adage goes, God helps those who help themselves.
 
 In essence, employ your intellect to recognize that many anxieties are self-generated; thus, the solutions or gratitude expressed reside within you. Prayer is not a transaction for a return but rather a process of reconciliation with oneself. This ultimately aids in accepting truth and allowing one's mind and body to live harmoniously. 
 
 Start living your prayers, for all the answers are within you.",musings
Enjoy what you do,"Enjoy what you do"" is common advice for new ventures. However, it's important to distinguish between ""enjoy"" and ""for enjoyment"" in this context.
 
 Activities ""for enjoyment"" are hobbies, not profit-driven pursuits. Many ventures fail when entrepreneurs confuse these categories. Unlike hobbies, which have flexible time and cost constraints, businesses operate within strict parameters.
 
 When hobbies evolve into businesses, they demand a fundamental shift in approach. Business isn't for the risk-averse; every venture faces potential failure despite careful planning. Therefore, thorough preparation for setbacks is essential.
 
 In business, success often stems from intangible factors that aren't immediately apparent. Acknowledging these subtle influences is crucial in understanding a business's current position.
 In essence, if pursuing your passion isn't an option, find ways to appreciate your obligations—that's the core of business.",musings
Randomness,"I must confess, I am somewhat inebriated while writing this, but I am determined to record my thoughts as they currently stand. Today, I experienced the power of unplanned events, which turned out to be one of my most memorable days. We often focus on planning to such an extent that it robs us of the unexpected, especially when it isn't about consequential matters.
 
 In this particular instance, we set out for one event but ended up somewhere else entirely, and had a fantastic time. I feel compelled to mention the name of the place, as it added a certain flavor to the experience: a restaurant called ""Seven Short One Long."" Admittedly, the name made little sense to me at first, but ultimately it proved worthy due to its culinary delights, enjoyable music, and the local brew Feni. The company of my friends only enhanced the experience.
 
 So, dear readers, when things don't go according to plan, don't be disheartened; instead, embrace randomness and give it a chance. You won't regret it.","memories, musings, random"
A Cleaner Wardrobe,"A wardrobe, often seen as merely a storage for our attire, holds much more significance to me. Indeed, attire is important, but when I open a wardrobe, I see it as a reflection of my conscience. Within it, I find two distinct sections: the current wardrobe I actively use and the overcrowded area filled with possessions.
 
 We tend to cling to these possessions, even if they no longer fit or serve a purpose. Reluctant to part with them, we convince ourselves that one day they will be useful again. However, I propose that your wardrobe mirrors your character and should be maintained like a clear conscience.
 
 Without delving too deeply into philosophy, let me offer some advice: declutter your wardrobe. Dispose of items that are no longer in use or pass them on to someone who might benefit from them. This act not only frees up space but also teaches you to share the good things you once enjoyed.
 
 By keeping minimal possessions that others may cherish rather than discard after we're gone, we reveal our true character. So begin with your wardrobe and cultivate a lean lifestyle.",musings
Identity and Adaptation,"Identity: I possess my own, as it should be. To maintain self-confidence, embracing this truth is crucial. This doesn't imply living in isolation; rather, master the art of adapting and adopting to surrounding forces while honoring one's identity. Our uniqueness enriches our existence.
 
 It's essential to recognize our interdependent existence and learn to maneuver for optimal results. We often hear the term identity crisis and associate it with superficial outward behavior. However, a crisis can also stem from an inward attitude attempting to avoid an explosion. Clinging onto such an attitude causes an implosion at your core, depriving you of self-belief - the worst form of identity crisis.
 
 Be outwardly confident in being yourself. Remember, you won't find another You.",musings
The Art of Laziness,"Laziness is indeed something.
 
 Far from nothing, laziness often stands in contrast to its praised counterpart, busyness. Society today tends to overlook the subtle art of being lazy. As activity take center stage, productivity is seldom questioned. We strive for action, yet few acknowledge that laziness can also serve as a quiet pursuit.
 
 Laziness is often misunderstood. Being lazy doesn't imply an absence of thought; in fact, one may think more in such circumstances. It's the action that gets delayed, allowing for a thorough examination of pros and cons, ultimately benefiting the decision-making process. At times, a lazy individual may deliver superior results when entrusted with an important task.",musings
Music and its Magic,"""Music to my ears"" is a statement often made when receiving pleasant news. The power of sound can either calm or excite our minds, depending on the genre chosen. It's hard to imagine life without music, as it transcends even religion in guiding our lives. Without music, life would be rather mundane.
 
 Don't mistake music for mere sound; it's the artistry in delivering those sounds. If there is no art involved, it becomes noise - quite different from music. However, one must consider that what may be music to one person could be noise to another; it's highly subjective. Nevertheless, when all elements harmonize, music stirs the soul.
 
 Make a habit of listening to music at least once a day, even if just for a few minutes. It will revitalize your mind. And of course, remember to thank the musicians.",musings
Canine Companionship,"Meet my cherished companion, Whisky. The name suits him well, as I adore both him and the beverage. I refrain from labeling him a mere ""dog,"" for we have often misused this term to describe a difficult existence. Whisky transcends such a label; he is, in fact, a king. He has his way, whether one likes it or not.
 
 Whisky possesses an uncanny understanding of commands before they are given and displays defiance before requests are made. At times overly energetic, the veterinarian suggested calming music for dogs – astonishingly, the same genre I use to soothe myself.
 
 It is said that humans are educated; one cannot help but wonder which esteemed institution Whisky attended. From now on, let us refrain from equating a challenging life with that of a dog's. Instead, attribute it to the owner's circumstances.","family, musings"
Redefining Poverty,"In today's world, the focus on alleviating poverty often revolves around material poverty. We tend to think of poverty mostly as a lack of food, shelter, and clothing, and leaders and religious figures emphasize serving the poor as a noble act. However, I must ask: what makes one feel wealthy enough to serve the poor? If we only view poverty as material, then perhaps having extra money qualifies us to help.
 
 But there is more to poverty than material circumstances; lack of attitudes such as gratitude, integrity, and equality contributes to the poverty of mindset. Some people may have enough but still feel poor, or their concern for others' well-being diminishes if someone else has more. This mindset must also be addressed.
 
 The notion of poverty extends beyond materialism. It isn't solely about financial aid or empathy for those with less; sometimes, those we deem ""poor"" possess a richer attitude towards life than their wealthier counterparts. We must recognize that we are all impoverished in our own ways.",musings
Betrayal and Trust Dynamics,"Betrayal is a one-way street—you either betray or feel betrayed. More often, feeling betrayed is our choice.
 
 Trust, the foundation that makes betrayal possible, is an investment we make. When returns diminish, we cry betrayal. Yet trading trust always carries risk. The solution? Trust with safeguards or without expectation of return.
 
 When betrayed, we cast others as enemies—but enemies are friendship's aftermath. Building relationships without expectations reduces the likelihood of creating adversaries. The pain of friends becoming foes remains our choice.
 
 Consider this: Accept people as they are, assigning them fitting roles in your life. As CEO of your existence, manage your relationships accordingly.",musings
New Year's Reflection,"As December ends, we anticipate the new year with resolutions born from our acknowledged flaws and hopes for improvement. We exchange 'Happy New Year' greetings in this spirit.
 
 In our digital age, mass-connecting has become effortless. Receiving hundreds of New Year wishes—and the obligation to respond—often reduces this tradition to a mechanical task, drawing quiet complaints.
 
 I once felt ashamed, catching myself grudgingly wishing someone happiness. This moment of self-awareness became pivotal—a call to align my words with genuine intent. Recognizing and working to overcome this human inconsistency is my resolution for 2024.
 
 A Happy New Year, indeed.",musings
The Paradox of Sinlessness,"A truly sinless life, if taken to its logical extreme, would be utterly devoid of value. Yet we often strive to adhere to such moral standards, thereby embracing hypocrisy at its core. Sins, as we call them, include lust, lies, and cheating.
 
 If these acts did not exist, life would be rather dull. Without lust, there would be little incentive to dress well. To understand lies, one must first question the nature of truth and the extent to which it should be communicated. Cheating is subjective, since anything kept secret can be interpreted as deceitful. Secrets often form the backbone of business and professional endeavors.
 
 These few examples illustrate the difficulty of living a sinless life. It is safe to say that anyone claiming to live without sin is committing a sin itself. So why vilify these acts that are commonplace in everyday life? Is it merely for the sake of earning heavenly merit?
 
 Try living just one day without sinful thoughts, actions, or words. Chances are you'll find yourself longing for hellish pursuits instead.
 
 Don't fret over sins as they have been portrayed.
 Perhaps it's time for an amendment: simply learn to live comfortably within your conscience.",musings
Faith,"What is faith, if not trusting oneself? Faith within ; would it not yield the same result? Why must we rely on others or religious doctrine? How entangled have we become in this web?
 
 In good times, we often have faith in ourselves, believing it will endure. So why do we shift it during challenging times? Instead, let's channel that energy into a self-sufficient faith, unburdened by dependencies.
 
 Facing reality becomes simpler with this approach. They say faith can move mountains, which means seeking answers within and shedding the weight of self-created obstacles. Each individual possesses the ability to discern expectations from possibilities and find peace. Yet societal norms lure us into believing in miracles.
 
 While no one has complete control over life's challenges, we often seek external saviors. This mindset validates miracles and leaves us vulnerable to exploitation. To avoid this trap, have faith in your understanding and make decisions best suited for you.
 
 Miracles or not, nothing lasts forever. Believing in oneself and maintaining faith until the end ‚Äì now that's a true miracle.",musings
