title,content,topics
"Confronting Mortality","Life: A Reflection
 
 It is my aim to help alleviate the fear of death, a challenging endeavor. Life permeates everything, and to believe otherwise is foolish. This is the doctrine we've become accustomed to.
 
 I remain unconvinced, not confused, but rather baffled that others fail to grasp the reality that all living things must eventually fade away. While I don't advocate embracing death, it's perplexing how some insist on the notion of eternal life. How naive can we be?
 
 If only we could accept the value of life lies in its finiteness, how much more meaningful would our existence be? It merely requires a shift in perspective, at no cost, but with the courage to face the truth. As they say, practice makes perfect; embrace this thought and find bliss. 
 Death is a gift of LIFE .",musings
"On Envy","Refrain from fantasizing about others,
 For it breeds envy and tarnishes the admirer.
 Do not claim it is human nature to feel so,
 But rather acknowledge you feel this way because you are human.
 
 As humans, we possess options, yet often neglect to explore them.
 Embrace reality as it is and become an engaged participant.
 
 Cherish the treasure of your time,
 Utilize it wisely and strive to be true to yourself.
 Avoid the pretense of goodness, for it may harbor deceit.
 If being you is inherently good, then that is your character.
 
 To fantasize about another's life is only to depreciate your own.",musings
"Who am I?","Thought for Today:
 
 Ask yourself, ""Who am I?"" 
 As you strive to understand yourself,
 Competing with others loses meaning.
 Your focus becomes solely on being you.
 
 The challenge lies in self-discovery,
 For we're often shrouded in falsehood.
 Yet, beneath the layers, you exist,
 Unburdened by accolades and attachments,
 Free of anxiety and at peace within.
 
 Spend time with yourself; it's worthwhile.",musings
"Minimalism and Ambition","The word ""more"" has become so fashionable that it nearly ridicules the concept of minimalism. With its unquenchable nature, one might question whether aspiring for more is a misguided pursuit. While I ponder this, I must admit that my answer may not be entirely conclusive.
 
 There is nothing inherently wrong with seeking more, provided that one keeps in mind the value of minimalism. Striking a balance between ambition and simplicity helps maintain one's identity and sanity. Solely chasing after more by aping without appetite can lead to greed, potentially sabotaging one's peace of mind.
 
 Minimalism need not imply scarcity; rather, it represents the precise amount needed for genuine contentment. Anything beyond that often serves as a means of seeking approval from society. This competitive mindset, focused on comparing oneself to others rather than personal growth, can result in restlessness.
 
 Let us give minimalism its due credit. After all, being a minimalist doesn't mean owning nothing; it means ensures that nothing owns you.",musings
"Contemplating Life's End","Often, I contemplate what I would do if I knew the end was near. What would sustain me until that inevitable moment? Initially, the thought was quite unnerving. However, with time and reflection, it became more manageable.
 
 Perhaps I would reconcile my past, a journey known only to myself. While many have contributed to it, life is ultimately one's own experience. Should I find myself facing the end, I am confident in relying on my memories to see me through. The memories with the comfort of being honest.
 
 The greatest joy I can draw is the fortune of having been born. At sixty-two, it feels as if this is just the beginning – the start of the unknown. The only certainty is that it will eventually come to an end.","musings, memories"
"Detachment","Many individuals fall into the trap of believing their belongings define them, subsequently identifying themselves as part of their possessions. This mindset gives rise to an identity crisis simply because once wealth is drained you also lose your character proportionately.
 
 So, who are you? Do riches make you who you are, or do you create your wealth? The answer is quite simple. If you are attached to material items, they shape your identity; conversely, if you are detached, it is you who creates your wealth. Who you are matters more then what you are.
 Detachment fosters a sense of sanity",musings
"The Blank Canvas","Blank ‚Äì a word that often elicits aversion, as it signifies emptiness. Yet, paradoxically, emptiness can hold more meaning than one might initially assume. Our inclination toward materialism has led us to fear the concept of emptiness.
 
 To foster creativity, humanity must learn the art of unlearning. Discarding redundant information allows us to start anew with fresh perspectives. In our ever-evolving world, mastering the skill of blanking one's mind and gaze is crucial.
 
 Embrace the blank, for it is within this emptiness that the sought-after Eureka moments arise. Empty the trash, and discover the attraction of being blank.",musings
"Moments","I recently watched a Charlie Chaplin film from 1914, which was undoubtedly amusing. Upon realizing it has been 107 years, I felt a sense of emptiness knowing none of the characters are still alive. This led me to ponder: did they ever imagine someone would find entertainment in their work after over a century? It seems unlikely.
 
 In today's context, with widespread insecurity due to the pandemic, our only option is to exercise caution and accept that we each traverse this path just once before becoming history. So, relax! It is merely a cycle - if not now, then later, we will all depart.
 
 Until then, let us relish the journey and remember it is a gift, not an entitlement. Every journey is best appreciated in moments; take pleasure in your presence at this very instant.","musings, memories"
"Anger","Getting angry seldom solves an issue; rather, it tends to worsen it. A calm mind is crucial for addressing life's challenges.
 
 Consider these practices:
 1. Be mindful of others' emotions and avoid causing harm.
 2. Remember it takes two to create misunderstanding contemplate your actions leading to the issue and devise ways to make amends.
 3. Swift solutions require effort; evading problems or shirking responsibility won't help, as true resolutions stem from within. 
 4. Prioritize significant tasks over pressing ones when strategizing.
 5. A relaxed mindset aids in navigating life's obstacles.
 6. Embrace happiness, as it not only affects your mood but also positively impacts those around you. Contentment flourishes when we observe happiness radiating onto others due to our conduct – that is what truly matters in life.",musings
"A Foot's Perspective","I glanced at my feet,
 Wondering if they were truly mine.
 They seemed defiant, as if unwilling to admit they belonged to me.
 A quiet inquiry arose: do you have time for us?
 
 Their complaint was evident,
 For they are last in line.
 Lacking the pampering of your face,
 Would you notice your shortcomings if we ceased our duties?
 
 We carry you without complaint,
 Bleeding for no fault of our own.
 Tired at times, yet we ensure you reach your destination.
 
 The lesson is clear:
 Take time to notice yourself - the whole you.
 Embrace your body,
 Thank every part for their service.
 You'll find no reason to complain,
 And begin to love yourself,
 Starting with your feet.",musings
"Heaven","While I don't dispute humanity's concept of heaven, my pursuit is to convince myself. Each time I question its existence, I'm compelled to explain the cosmos and its creator. If not a divine being in heaven, then who?
 
 I find myself cornered, lacking a persuasive explanation. However, I reassure myself that ignorance doesn't grant others the right to peddle myths. I believe time will eventually unveil the truth, as it has for many mysteries unknown to previous generations but understood today.",musings
"Remembering Joe","This morning is unlike any other, as the date November 15th, 2022 will forever remain etched in our memories. Our cherished brother Joe has passed away. While we mourn, we also rejoice in the fact that he was born and became an integral part of our lives.
 
 We were honored to have him as our leader. Despite occasional disagreements, mutual respect always prevailed – a virtue instilled in us by our parents, who taught us to respect our elders. Joe was the eldest among us, and his absence leaves a void difficult to fill.
 
 Nevertheless, we shall persevere and uphold the pride of declaring that ""We are Ten."" Although our ranks have begun to dwindle, forcing us to say ""We were Ten,"" the number ten will endure until the end.","family, memories, musings"
"Relationships","For a thriving, contented relationship, it's crucial to accept the unvarnished truth. Often, we hear that relationships involve compromise and give-and-take, but rarely are we told how much to give or take in order to maintain a successful partnership.
 
 The notion of give-and-take trying to maintain balance can be misguided. A healthy relationship involves agreeing to disagree, while setting boundaries that respect one another's feelings even if full agreement isn't reached. This approach safeguards one's identity, as excessive compromise can erode self-respect and ultimately lead to the dissolution of the relationship.
 
 For a robust relationship, open-mindedness is essential. Recognizing what is right should take precedence over who is right.
 A relationship built solely on compromise lacks genuine connection.
 Remember you have one life. Make it worthwhile.",musings
"Life's Brief Wisdom","Why the haste for tomorrow,
 When today has yet to conclude?
 Still, we lament,
 Life is brief.
 
 Regardless of our presence, tomorrow approaches.
 Today offers ample time if one observes their surroundings.
 A recent encounter sparked this reflection:
 A middle-aged man sat alone, striking stones together, delighting in their resonance.
 
 I hesitate to label him a beggar,
 For who am I to categorize others?
 If I must assign a title,
 Let it be ""teacher,""
 For he imparted wisdom upon me.
 
 He bore no regret,
 Seemingly content with life's trajectory.
 Almost telling me you are not here cause i have taken that space .
 
 Our interdependence is undeniable;
 No one person holds less or more significance.",musings
"Wealth vs. Freedom","The Paradox of Plentifulness: A Billionaire's Thoughts
 
 Delving into a billionaire's mind, I contemplate what they possess that eludes me. I value my freedom to roam the streets and having adequate means for a comfortable existence.
 
 For billionaires, privacy and independence are relinquished; security constantly surrounds them. Vigilance is crucial in their daily lives, preventing leisurely interactions with street vendors or enjoying simple delights in public spaces.
 
 Their vast wealth often benefits others more than themselves. Society admires billionaires for lavish items like timepieces valued tens of thousands above ordinary ones, although both display the same hour. This raises questions about society's wealth obsession and to what extent it truly belongs to an individual.
 
 I respect the billionaire for their sacrifices, which are often misinterpreted .
 Upon reflecting on their journey to attain such status, one realizes the selflessness they embody, as ultimately, they share their achievements with others – willingly or not.",musings
"Destiny","Destiny, as explained, refers to events beyond our control. I find solace in this concept, as it allows me to outsource my anxiety to the power of randomness, believing that I am not entirely in control of any outcome, even if it means a 0.1% chance of an unexpected result.
 
 Often, I have passionately defended this notion against friends who argue that our destiny lies in our own hands. Their perspective may seem sensible when they suggest that we must put forth effort to shape our desired destination; otherwise, it is akin to leaping into the sea without learning to swim. It can be challenging to counter such observations without falling into their trap.
 
 However, I maintain that destiny does not equate to irrational beliefs. In fact, acknowledging destiny enables one to prepare thoroughly for any foreseeable eventuality while simultaneously accepting that unforeseen circumstances may occur.
 Ultimately I am convinced that my being is determined by time. How long, no one knows.","musings, random"
"Shifting Perceptions","It can be rather amusing to observe one's shift in perception about a person or an organization. At times, the change of feelings can be quite dramatic, transforming someone from an angel to a devil. In such instances, a conscious mind might wonder why such a shift occurs.
 
 This phenomenon demonstrates the biased nature of humans. We often draw conclusions without proper diligence and believe ourselves to be correct. We propagate our beliefs to others as if they were gospel truth, almost to the point of no return. However, when our expectations are not met by that person or group, we become frustrated and alter our perception in the opposite direction. In doing so, we paint the entire canvas without realizing that merit may exist in some actions of the once-adored individual.
 
 When cornered, we activate bias and defend the indefensible. In such cases, it is crucial to amend our belief system and understand that every person possesses their own mindset. Their actions may not always meet our expectations, but before passing judgment, we should avoid bias and let merit prevail. As the saying goes, give the devil its due.",musings
"Guilt: A Prison","Prison: upon hearing this word, one often envisions crime, barbed wire, and towering walls – all symbols of restricted freedom. Prisons are commonly associated with punishment meted out by authorities for proven wrongdoing. Yet, if a crime remains unproven, are we truly innocent?
 
 According to the law, we are – and justifiably so. However, at this point, we may imprison our own conscience by telling a lie and subsequently experiencing guilt. Nature possesses its own methods; it does not rely on external prisons but rather imprisons us within ourselves. To savor genuine freedom, live by your conscience.",musings
"Honesty and Truth","Honesty extends beyond merely telling the truth; it also encompasses refraining from telling a lie . While these terms bear a resemblance, they differ significantly. One can be honest without necessarily revealing the whole truth.
 
 Truth may not always warrant disclosure, but lying burdens one for a lifetime,
 Honesty allows us to accept our imperfections. Circumstances may compel us to withhold truth, yet if it holds value, it shall ultimately triumph.
 
 Be honest to oneself.",musings
"Aging and Acceptance","Age, often considered a simple number, conceals its true influence on our abilities. Tasks manageable at 20 may become challenging at 60. We must acknowledge that age carries implications beyond mere digits.
 
 Growing older bestows wisdom and acceptance of age-related limitations. As more yesterdays accumulate than tomorrows, an unavoidable slowdown emerges.
 
 Our minds maintain youthful vigor while our bodies bear life's journey's marks. Nostalgia shades our perceptions, as diminishing physical capacities influence our view of the past.
 
 Embracing aging without regret is essential, but recognizing its changes is equally crucial, 
 Age is a just a number – but be mindful that as this number adds the balance reduces.
 Enjoy life in a hurry. Celebrate your birth everyday and don't wait for the one day per year.
  
 For comfort answer this: How old would you be if you didn't know the day you were born?","musings, memories"
"Panjim: Reflecting on 50 Years","At the age of thirteen, Panjim became a part of my life due to monthly visits to Goa Medical College for treatment of Rheumatoid arthritis. This continued for a few years until I stopped the treatments. One injection was particularly painful due to the non-micro needles used back then. Consequently, Panjim wasn't associated with pleasant experiences.
 
 In May 1972, I stayed in Panjim for twelve days, not on a vacation but in a hospital prior to follow-up treatments. Thus, I can safely share my observations of Panjim over the last fifty years.
 
 My daily trips to Panjim began in 1975 after failing tenth grade (a story for another time). With time on my hands, I traveled via launch service from Diwar (Gazolin) to Panjim Navigation Department.
 Back then, Panjim still had a colonial atmosphere. The Portuguese word for officer, ""empregado,"" was frequently heard, and siesta was observed by closing shops and offices between one and three in the afternoon. People leisurely enjoyed lunch and ""cerveja"" (beer) was popular.
 
 Commercial Panjim centered around St. Tome square, also known as Tobacco square, where our small shop, L.A. Armacar, was located. Most dwellings were two stories high with tile rooftops. Hotel Mandovi and later Tourist Hostel were prominent buildings. Cars were few; ""Ponte de Linhares,"" the bridge, was the entry and exit route to the city with a stop-and-go sign operated by the police.
 Restaurants served Goan food without Chinese or Mughlai influences; Udupi cuisine marked the first culinary change.
 
 Now, fifty years later and back in St. Tome, memories flood in as I count the merchants (known as ""negociante"" back then) and recall their business practices. Most establishments have closed or changed, supporting the idea that businesses have a lifespan of about forty years unless they adapt.
 
 Emotions stir within me as I accept that the square has retained its architecture but its soul and the surroundings have changed. I console myself that fifty years have changed me as well.","memories, musings"
"Body and Mind","We often mention the need to control our bodies, which may be true, but sometimes the mind enters overdrive when it realizes the body isn't meeting expectations - we call this sickness. At this point, we must train our minds not to think of extreme solutions, but instead allow our bodies the opportunity to activate all available options to return us to the right course.
 
 It's important to acknowledge that our bodies have built-in remedies for everyday ailments that don't require specialist intervention. This is not to undermine medical professionals, whose value is truly appreciated when we are in distress. However, we must also recognize that medicine is a profession, and like all professions, it involves financial considerations.
 
 The existence of more hospitals doesn't necessarily mean fewer patients; rather, for medical professionals to thrive, they must not only cure existing patients but also create new ones.",musings
"Perfection","Perfection is a pursuit and will remain so, though many of us strive to attain it in our endeavors. Keep in mind that perfection is a relative phenomenon, not an absolute one.
 
 One may satisfy their urge by deeming the outcome perfect, which is relative to one's feelings, but nothing can be absolutely perfect. It is rightly said that perfection is boring, as it halts progress, and life is essentially a work in progress.
 
 Let perfection be your pursuit, and progress will follow.",musings
"Reflecting on Pascu's Milestone","As my youngest sibling Pascu (Anand) approaches his half-century milestone, I can't help but reflect on a similar, albeit different, moment in my own life. Forty-seven years ago, while in ninth grade, my young mind grappled with life's challenges and the overwhelming anxiety of uncertainty. To comfort myself, I reminded myself that nothing is permanent and things would change.
 
 I then daydreamed about the day Pascu would complete his fiftieth year. I pictured how we would look, where we would be, and what our status might be, hoping we'd all be achievers in our own right. Most importantly, I wondered if I would remember this moment.
 
 Today, as that day approaches, I'm humbled and ecstatic to realize my wish of us being achivers has come true. Though I wish all ten of us could gather to commemorate this event – sitting in silence, reminiscing about the past with gratitude for our wonderful journey thus far, the pandemic has made this impossible.
 
 Nevertheless, this red-letter day fills me with overwhelming emotion and a desire to celebrate it:
 
 Cheers to the day!
 
 Happy Birthday Pascoal Anand Hermigildo de Delfino Pereira
 
 Stay young and blessed, brother.","family, memories, musings"
"Grandfather's Joy: Maya's Impact","Xapai,
 The title I opted for; instead of grandpa 
 Now sounds even sweeter when my granddaughter Maya
 Calls me by it.
 Sixty one years to earn this title,
 Probably nature, in its wisdom, chose the perfect moment.
 
 I feel truly blessed by my granddaughter, for she has invigorated my life.
 It is often said that to feel different, one must awaken the child within. This is precisely what occurs each time Maya is with me; the child inside me stirs. However, I also envision her journey through a long life ahead. Intelligent and already conscious of her appearance, she desires to be well-groomed and often affirms her own beauty.
 
 I know she will perceive life differently than I did, as her future lies in an advanced world. My hope is that she adheres to worthy values, and perhaps some parts from my writing will aid her in achieving this.","family, musings"
"May the soul rest in peace","This phrase, often employed to console, seems to be on autopilot these days. We must thank whoever initiated this comforting expression, as it has undoubtedly simplified our lives. Yet, having used it countless times, I find myself questioning its meaning and my authority to wish such a thing for the deceased.
 
 What is the soul? My search began with the dictionary, which defines it as the spiritual and immaterial part of a human being, regarded as immortal. This immortality implies that the soul is endless. Thus, another question arises: what does peace mean for something infinite?
 
 In our world, we experience peace when we recognize and overcome its opposites – violence, chaos, unrest, confusion, etc. Therefore, peace cannot be endless. Since the soul is immortal, it seemingly disqualifies from experiencing eternal peace. So I decided to abandon the phrase altogether.
 
 This realization led me to ponder why we feel anguish over death. Ultimately, death signifies the end of everything for the deceased; we have no authority to wish them anything but to remember their deeds fondly if they inspire positive feelings.
 
 However, we tend not to practice this because our emotions focus on what we lose when someone dies and what we may miss after our own demise. Thus, it has more to do with ourselves than the departed.
 
 Rather than wishing for souls to rest in peace after death, perhaps it is more fitting to ask ourselves: how content is my soul while I am alive and well?",musings
"Frustration: A Common Dilemma","We all construct our ideal worlds, influenced by our expectations and desires. Often, we attempt to enforce these ideals on others to achieve our goals. However, when met with opposition, frustration arises, casting a gloomy outlook on the future. This is particularly common when the implementation of our ideals is dependent on others.
 
 It is essential to recognize that each of us has unique expectations aimed at improving our individual worlds. We take ownership of ""our world"" but it has to be ""my way"". This attitude proves to be impractical. At this point its crucial to recognise that one can improve the situation on focusing on things within one's control.
 
 Accept that you are ultimately responsible for your happiness. If necessary, adjust your perception and focus on living life on your terms within a smaller scope. The world is beautiful ‚Äì don't squander your time indulging in frustration.",musings
"Marriage","Getting married is not an achievement; sustaining a marriage for a lifetime is, especially in today's environment. Admittedly, aligning two minds for a lifetime is no easy task. However, such an admission rarely comes to light before the marriage, as it is often portrayed as ""made in heaven."" To me, this notion seems illogical unless heaven is as good as marriage. Then, at times one might wonder where hell resides.
 
 Marriage is a worthy endeavor only if both parties accept that it comes with an unknown package and unforeseen challenges to overcome, bound by love rather than law. Respect for one another should supersede all else; with a respectful mindset, true love can flourish while mere infatuation fades. 
 
 Love at first sight moments do exist, but it is crucial to remember that sight is not constant.
  
 Despite conflicts there are lasting partnerships not because they are made in heaven but could be attributed to one or both partners being divinely crafted.
 
 A happy marriage is always a work in progress.","musings, family"
